{
 "claim": "A-001",
 "checker": "Gravit Open Network Foundation",
 "relation_to_author": "author",
 "date": "2026-10-13",
 "environment": "clean clone, macOS, system Python 3.9.6",
 "command": "make eval",
 "code_version": "gravit-eval-pack a1f72cf",
 "result": "NOT REPRODUCED",
 "notes": "Installation failed: Python >= 3.10 needed but not stated; broken .venv left behind. Fixed in gravit-eval-pack PR #2."
}
